<?xml version="1.0" encoding="UTF-8"?> 
<!DOCTYPE events SYSTEM 'events.dtd'> 
<events> 
	<event>
		<index>0</index>
		<id>match_1</id>
		<event_type>match</event_type>
		<name>mmmmmmmmmmmmmmmmmmmmmmmmmmmmmmmmmmmmmmmkkkkkkkkkkkkkkkkkkkkkkkkkkkkkkkkkkkkkkkkkkkkkkmmmmmmmmmmmmmmmmmmmmmmmmmmmmmmmmmmmmmmmmmmkkkkkkkkkkkkkkkkkkkkkkkk</name>
		<date>2024-11-11</date>
		<time_period>11:11</time_period>
		<type>aüq</type>
		<place>üeä</place>
		<club0>äääe</club0>
		<club1>öüce</club1>
		<points0></points0>
		<points1></points1>
		<info_text>c</info_text>
		<notice></notice>
	</event>
</events>